{
  "contract": "transformer-flight",
  "version": 1,
  "jobId": "33333333-3333-4333-8333-333333333333",
  "payloadId": "44444444-4444-4444-8444-444444444444",
  "ordinal": 0,
  "status": "committed",
  "rows": 3,
  "batches": 2,
  "bytes": 1434,
  "sha256": "eb454cc6a7bd34dc00d818d9e39282b359a309b151dbaa31a9f86e876f3d17bb",
  "schemaFingerprint": "a5326a4ece5fcaf07e2f4022aa726f4fe9a29d66d2e5e6c227fb376ab90dd96c"
}
